metric_id,metric_label,mp11_value_ha,phase5_reference_label,phase5_reference_ha,delta_ha,delta_percent_vs_phase5,mp11_pdf_pages,mp11_source_context,phase5_source,comparison_interpretation,review_status,downstream_use,model_input_status,notes
total_landbase,Total TFL area / total land base,217197.0,P1.6 current FADM-derived TFL 6 AOI,217042.71895,154.2810499999905,0.07108326450496233,"15, 19, 283, 284",Main document section 2.2; Appendix B Table 12,planning/tfl6_adjusted_thlb_benchmarks.json,Rounded MP11 land-base area is within 0.1% of the Phase 5 FADM-derived AOI; boundary area is effectively aligned for planning comparison.,reviewed_evidence,phase6_land_base_comparison_only,not_model_input,Reviewed planning comparison row. Values are not accepted model inputs until a later implementation phase explicitly promotes them.
total_forested,Total forested,196233.0,P2.4e smoke total forested,196833.177,-600.176999999996,-0.3049165842605873,284,Appendix B Table 12,planning/tfl6_thlb_benchmark_tolerance.md,MP11 total forested area is close to the Phase 2 smoke checkpoint; difference is small relative to total land base.,reviewed_evidence,phase6_land_base_comparison_only,not_model_input,Reviewed planning comparison row. Values are not accepted model inputs until a later implementation phase explicitly promotes them.
productive_forest,Productive forest / PFLB / AFLB-style checkpoint,187425.0,Phase 5 accepted AFLB resultant-fragment area,191168.597386,-3743.5973860000086,-1.958270049155137,"15, 54, 284",Main document section 2.2; Appendix B Table 12,planning/tfl6_model_input_bundle_qa.md,MP11 productive forest is lower than the accepted Phase 5 AFLB surface. This is a direct Phase 6 land-base delta requiring source-layer and netdown review.,reviewed_evidence,phase6_land_base_comparison_only,not_model_input,Reviewed planning comparison row. Values are not accepted model inputs until a later implementation phase explicitly promotes them.
total_operable,Total operable,156305.0,P2.4e smoke total operable,174768.947,-18463.946999999986,-10.564775560500452,284,Appendix B Table 12,planning/tfl6_thlb_benchmark_tolerance.md,MP11 total operable area is materially lower than the Phase 2 smoke checkpoint; operability and economic operability assumptions need dedicated P6.4 review.,reviewed_evidence,phase6_land_base_comparison_only,not_model_input,Reviewed planning comparison row. Values are not accepted model inputs until a later implementation phase explicitly promotes them.
current_thlb,Current THLB,120099.0,Phase 5 accepted weighted THLB area,139995.798287,-19896.798287000012,-14.212425323087446,"15, 53, 75, 284, 285",Main document section 2.2; Appendix A Executive Summary; Appendix B Table 12,planning/tfl6_model_input_bundle_qa.md,MP11 current THLB is substantially lower than the accepted Phase 5 THLB surface. This is the central land-base delta for MP11 model-overhaul planning.,reviewed_evidence,phase6_land_base_comparison_only,not_model_input,Reviewed planning comparison row. Values are not accepted model inputs until a later implementation phase explicitly promotes them.
non_contributing_landbase,NCLB / productive forest not available for harvesting,67326.0,Phase 5 accepted NTHLB area,51172.799099,16153.200900999997,31.56599049770497,15,Main document section 2.2,planning/tfl6_model_input_bundle_qa.md,"MP11 NCLB is higher than the Phase 5 NTHLB surface, consistent with the lower MP11 THLB.",reviewed_evidence,phase6_land_base_comparison_only,not_model_input,Reviewed planning comparison row. Values are not accepted model inputs until a later implementation phase explicitly promotes them.
long_term_landbase,Long-term land base after future roads,118672.0,Scaled MP10 long-term landbase benchmark,134598.87,-15926.869999999995,-11.832840795765964,"54, 285",Appendix A Executive Summary; Appendix B Table 12,planning/tfl6_adjusted_thlb_benchmarks.md,MP11 long-term land base is materially lower than the prior scaled benchmark; Phase 5 did not implement future-road long-term adjustment as an active base-lane output.,reviewed_evidence,phase6_land_base_comparison_only,not_model_input,Reviewed planning comparison row. Values are not accepted model inputs until a later implementation phase explicitly promotes them.
current_aac_supporting_thlb,Current AAC-supporting THLB from previous MPs,133665.0,Scaled MP10 current-THLB benchmark,136487.728,-2822.728000000003,-2.068118534437032,53,Appendix A Executive Summary previous-MP aggregation statement,planning/tfl6_adjusted_thlb_benchmarks.md,"MP11 reports a previous-MP aggregated THLB close to the Phase 5 scaled benchmark, supporting the earlier benchmark as a reasonable planning reference.",reviewed_evidence,phase6_land_base_comparison_only,not_model_input,Reviewed planning comparison row. Values are not accepted model inputs until a later implementation phase explicitly promotes them.
